{
  "contextPackId": "urn:srcos:context-pack:ops-history-redacted-demo",
  "specVersion": "0.1.0",
  "scope": {
    "roomRef": "urn:srcos:matrix-room:sourceos-build",
    "threadRef": "urn:srcos:thread:ops-history-demo",
    "workroomRef": "urn:srcos:workroom:professional-intelligence-demo",
    "topicRef": "urn:srcos:topic:professional-intelligence",
    "sessionRef": "urn:srcos:agent-session:codex-demo-0001"
  },
  "payloadMode": "redacted",
  "sourceEventRefs": [
    "urn:srcos:ops-history-event:demo-agentterm-0001"
  ],
  "artifactRefs": [],
  "policyDecisionRefs": [
    "urn:srcos:policy-decision:ops-history-redact-event-demo-0001"
  ],
  "agentRegistryRefs": [],
  "redactionRefs": [
    "urn:srcos:redaction-tombstone:demo-credential-boundary-0001"
  ],
  "retention": {
    "mode": "deny-writeback",
    "ttlSeconds": null,
    "writebackAllowed": false,
    "promotionRequiresPolicyDecision": true
  },
  "evidenceRefs": [
    "urn:srcos:evidence:ops-history-context-pack-redacted-demo"
  ]
}
