{
  "contextPackId": "urn:srcos:context-pack:ops-history-bearbrowser-agent-runtime-demo",
  "specVersion": "0.1.0",
  "scope": {
    "roomRef": null,
    "threadRef": null,
    "workroomRef": "urn:srcos:workroom:professional-intelligence-demo",
    "topicRef": "urn:srcos:topic:professional-intelligence",
    "sessionRef": "urn:srcos:browser-session:agent-runtime-demo-0001"
  },
  "payloadMode": "metadata-only",
  "sourceEventRefs": [
    "urn:srcos:bearhistory-event:agent-runtime-navigation-0001"
  ],
  "artifactRefs": [],
  "policyDecisionRefs": [
    "urn:srcos:policy-decision:ops-history-browser-event-export-demo-0001"
  ],
  "agentRegistryRefs": [
    "urn:srcos:agent-grant:ops-history-browser-demo"
  ],
  "redactionRefs": [],
  "retention": {
    "mode": "ephemeral",
    "ttlSeconds": 86400,
    "writebackAllowed": false,
    "promotionRequiresPolicyDecision": true
  },
  "evidenceRefs": [
    "urn:srcos:evidence:ops-history-context-pack-bearbrowser-demo"
  ]
}
